{
  "template_id": "iteration_plan_v1",
  "task_id": "2026-04-30-slot-artifact-renderer",
  "revision": 2,
  "title": "Iteration Plan",
  "user_request": "Implement the slot-based governance artifact workflow so fixed template content is rendered by deterministic scripts, while agents provide only variable slots and small update patches. Start with ITERATION_PLAN and preserve support for updating a plan during task execution.",
  "existing_behavior": [
    "Agents currently create or update tasks/<date>-<slug>/ITERATION_PLAN.md directly from a Markdown template.",
    "Fixed headings, tables, default copy, and empty rows are repeatedly generated by the model.",
    "context-indexer indexes task Markdown files as ordinary task history, so generated template text can be treated as meaningful context.",
    "Deterministic scripts already live in tools/ and skills/*/scripts/, use the Python standard library, and expose stable JSON output contracts."
  ],
  "reuse_patterns": [
    {
      "id": "pattern-cli-helper",
      "pattern": "Deterministic CLI helper",
      "source": "tools/*.py, skills/*/scripts/*.py",
      "reuse": "Add stdlib-only render/update scripts with JSON input and JSON output."
    },
    {
      "id": "pattern-task-template",
      "pattern": "Template payload source",
      "source": "templates/tasks/_template/ITERATION_PLAN.md",
      "reuse": "Keep human-readable Markdown shape compatible with the existing task artifact."
    },
    {
      "id": "pattern-context-index",
      "pattern": "Context index generation",
      "source": "skills/context-indexer/scripts/build_context_index.py",
      "reuse": "Detect generated Markdown and index source slots instead of fixed template text."
    },
    {
      "id": "pattern-selftest",
      "pattern": "Self-test style",
      "source": "tests/test_harness_v6.py, tests/selftest.py",
      "reuse": "Add focused unittest coverage for rendering, patching, and indexing."
    }
  ],
  "expected_changes": [
    "AGENTS.md",
    "README.md",
    "README.zh-CN.md",
    "docs/architecture/API_CONTRACTS.md",
    "docs/architecture/ARCHITECTURE.md",
    "docs/conventions/ITERATION_CONTRACT.md",
    "docs/memory/PROJECT_MEMORY.md",
    "skills/context-indexer/scripts/build_context_index.py",
    "skills/iteration-planner/SKILL.md",
    "templates/AGENTS.md",
    "templates/artifacts/ARTIFACT_TEMPLATES.json",
    "templates/artifacts/schemas/iteration_plan_v1.schema.json",
    "templates/docs/conventions/ITERATION_CONTRACT.md",
    "tests/selftest_helpers.py",
    "tests/test_governance_artifact_renderer.py",
    "tests/test_harness_v6.py",
    "tools/render_governance_artifact.py",
    "tools/update_governance_artifact.py",
    "tasks/2026-04-30-slot-artifact-renderer/QUALITY_GATE_INPUT.json",
    "tasks/2026-04-30-slot-artifact-renderer/QUALITY_REPORT.md"
  ],
  "files_not_to_change": [
    ".codex-plugin/plugin.json",
    ".claude-plugin/plugin.json",
    "Package manifests or dependency files",
    "Existing historical task artifacts outside this task directory",
    "tools/init_project.py copied path behavior unless required by tests"
  ],
  "new_files": [
    {
      "id": "file-renderer",
      "file": "tools/render_governance_artifact.py",
      "why": "Existing scripts do not render task artifacts from structured slots."
    },
    {
      "id": "file-updater",
      "file": "tools/update_governance_artifact.py",
      "why": "Existing scripts do not apply small plan update operations with revision checks."
    },
    {
      "id": "file-registry",
      "file": "templates/artifacts/ARTIFACT_TEMPLATES.json",
      "why": "Existing Markdown templates do not define machine-readable template IDs or renderer metadata."
    },
    {
      "id": "file-schema",
      "file": "templates/artifacts/schemas/iteration_plan_v1.schema.json",
      "why": "Slot payload shape needs a durable public contract."
    },
    {
      "id": "file-tests",
      "file": "tests/test_governance_artifact_renderer.py",
      "why": "Existing tests do not cover slot rendering or patch updates."
    },
    {
      "id": "file-task-slots",
      "file": "tasks/2026-04-30-slot-artifact-renderer/ITERATION_PLAN.slots.json",
      "why": "This task should exercise the new slot-based plan source."
    },
    {
      "file": "tasks/2026-04-30-slot-artifact-renderer/QUALITY_GATE_INPUT.json",
      "why": "Quality gate needs a durable task-local evidence input.",
      "id": "file-quality-gate-input"
    },
    {
      "file": "tasks/2026-04-30-slot-artifact-renderer/QUALITY_REPORT.md",
      "why": "Quality gate result should be reviewable with the task evidence.",
      "id": "file-quality-report"
    }
  ],
  "dependencies": "No new dependencies.",
  "tests": [
    "python3 tests/test_governance_artifact_renderer.py",
    "python3 tests/test_harness_v6.py",
    "python3 tests/selftest.py",
    "python3 -m compileall tools skills tests",
    "python3 skills/engineering-standards-governor/scripts/check_engineering_standards.py --project . --scope diff --diff-base origin/main --format text",
    "python3 skills/quality-gate/scripts/run_quality_gate.py tasks/2026-04-30-slot-artifact-renderer/QUALITY_GATE_INPUT.json"
  ],
  "risks": [
    {
      "id": "risk-indexer-source-missing",
      "text": "Treating generated Markdown differently in the indexer can hide useful task history if source slots are missing.",
      "status": "mitigated by falling back to Markdown text when the source slot file is missing"
    },
    {
      "id": "risk-array-drift",
      "text": "JSON update operations that address array indexes directly can drift.",
      "status": "mitigated by domain-level item-ID operations"
    },
    {
      "id": "risk-public-contract",
      "text": "Adding generated artifact contracts changes public helper behavior and must be documented in API contracts.",
      "status": "mitigated by API contract and README updates"
    }
  ],
  "rollback": "Remove the new renderer/update scripts, artifact template metadata, focused tests, generated plan slots, and the context-indexer generated Markdown special case. Restore iteration-planner documentation to direct Markdown creation.",
  "revision_history": [
    {
      "revision": 2,
      "updated_at": "2026-04-30T00:00:00Z",
      "reason": "Final verification added quality-gate evidence artifacts.",
      "changed_paths": [
        "/expected_changes",
        "/expected_changes",
        "/new_files",
        "/new_files",
        "/tests"
      ]
    }
  ]
}
