{
  "template_id": "iteration_plan_v1",
  "task_id": "2026-04-30-release-6-2-3",
  "revision": 1,
  "title": "Iteration Plan: Release 6.2.3",
  "user_request": "Submit the completed slot-based governance artifact workflow as a new Project Governor patch version.",
  "existing_behavior": [
    "Current public plugin metadata and documentation point at version 6.2.2.",
    "Release metadata is tracked in CHANGELOG.md, releases/<version>.md, releases/FEATURE_MATRIX.json, README files, tests, and docs/upgrades/UPGRADE_REGISTER.md.",
    "The completed feature adds deterministic governance artifact rendering and revision-checked slot updates, with context-indexer read-side optimization for generated Markdown."
  ],
  "reuse_patterns": [
    {
      "id": "release-ledger",
      "pattern": "Patch release ledger",
      "source": "tasks/2026-04-30-release-6-2-2, releases/6.2.2.md, docs/upgrades/UPGRADE_REGISTER.md",
      "reuse": "Publish a low-risk patch release with feature matrix, release notes, README refs, tests, and upgrade advisory evidence."
    },
    {
      "id": "metadata-sync",
      "pattern": "Version sync",
      "source": ".codex-plugin/plugin.json, .claude-plugin/plugin.json, tests/selftest.py, tests/test_harness_v6.py, tests/test_claude_code_compat.py",
      "reuse": "Keep Codex and Claude plugin surfaces and version assertions aligned."
    },
    {
      "id": "slot-plan",
      "pattern": "Slot-rendered plan",
      "source": "tools/render_governance_artifact.py",
      "reuse": "Use the new artifact renderer for this release task plan."
    }
  ],
  "expected_changes": [
    ".codex-plugin/plugin.json",
    ".claude-plugin/plugin.json",
    "examples/claude-marketplace/.claude-plugin/marketplace.json",
    "README.md",
    "README.zh-CN.md",
    "CHANGELOG.md",
    "releases/6.2.3.md",
    "releases/FEATURE_MATRIX.json",
    "docs/upgrades/UPGRADE_REGISTER.md",
    "docs/memory/PROJECT_MEMORY.md",
    "tests/selftest.py",
    "tests/test_harness_v6.py",
    "tests/test_claude_code_compat.py",
    "tasks/2026-04-30-release-6-2-3/*"
  ],
  "files_not_to_change": [
    "Package manifests or lockfiles",
    "releases/MIGRATIONS.json unless a project migration is required",
    "Historical release note bodies for older versions",
    "Deterministic helper output schemas beyond the already documented 6.2.3 feature work"
  ],
  "new_files": [
    {
      "id": "release-notes",
      "file": "releases/6.2.3.md",
      "why": "Each released version has a dedicated release note."
    },
    {
      "id": "release-task-plan",
      "file": "tasks/2026-04-30-release-6-2-3/ITERATION_PLAN.slots.json",
      "why": "The release needs a task-local plan and evidence."
    },
    {
      "id": "release-upgrade-input",
      "file": "tasks/2026-04-30-release-6-2-3/UPGRADE_ADVISORY_INPUT.json",
      "why": "Version changes require upgrade-advisor evidence."
    },
    {
      "id": "release-quality-report",
      "file": "tasks/2026-04-30-release-6-2-3/QUALITY_REPORT.md",
      "why": "The release needs task-local verification evidence."
    }
  ],
  "dependencies": "No new dependencies.",
  "tests": [
    "python3 skills/upgrade-advisor/scripts/analyze_upgrade_candidates.py tasks/2026-04-30-release-6-2-3/UPGRADE_ADVISORY_INPUT.json",
    "python3 tests/test_governance_artifact_renderer.py",
    "python3 tests/test_harness_v6.py",
    "python3 tests/test_claude_code_compat.py",
    "python3 tests/selftest.py",
    "python3 -m compileall tools skills tests claude",
    "python3 skills/engineering-standards-governor/scripts/check_engineering_standards.py --project . --scope diff --diff-base origin/main --format text",
    "python3 skills/quality-gate/scripts/run_quality_gate.py tasks/2026-04-30-release-6-2-3/QUALITY_GATE_INPUT.json",
    "git diff --check"
  ],
  "risks": [
    {
      "id": "risk-version-drift",
      "text": "Codex, Claude, README, feature matrix, and test version strings can drift.",
      "status": "mitigated by targeted version assertions and self-test"
    },
    {
      "id": "risk-migration-signal",
      "text": "The release touches AGENTS/template rules and must not imply blind initialized-project overwrites.",
      "status": "mitigated by feature matrix migration metadata and upgrade-register notes"
    }
  ],
  "rollback": "Revert the 6.2.3 version bump, release note, feature matrix entry, upgrade register row, README/test version refs, and release task evidence."
}
